{
  "schema_version": "1",
  "production_enabled": false,
  "repository": "trading-optimizer-lab-org/aurora",
  "repository_node_id": null,
  "issue_number": null,
  "issue_node_id": null,
  "exact_title": "AURORA CATALOG AUTHORITY LEDGER - DO NOT EDIT",
  "creator_login": null,
  "created_at": null
}
